{
  "condition_id": "CND-BND-0002-FDN-002",
  "boundary_id": "BND-0002-FDN",
  "type": "OUTSIDE_CORNER",
  "position": [
    60,
    0
  ],
  "orientation": 90.0,
  "status": "DETECTED",
  "evidence": {
    "rule": "cross_product_sign(positive_in_CCW_polygon",
    "geometry_inputs": "vertex_1_of_4_at_(60,0)",
    "tolerances_used": {
      "corner_angle_threshold_degrees": 10,
      "vertex_merge_tolerance_units": 0.25,
      "minimum_edge_length_units": 0.5
    },
    "cross_product": 2400,
    "angle_degrees": 90.0
  },
  "lineage": {
    "source_authority": "10-Construction_OS",
    "boundary_id": "BND-0002-FDN",
    "trace_type": "FOUNDATION_OUTLINE",
    "units": "feet",
    "detection_method": "geometry_vertex_analysis",
    "detected_at": "2026-04-02T01:19:39.574435+00:00"
  }
}